image_name|comment_number|comment|original|target
578910261.jpg|0| dental A technician is completing a procedure on a patient .| A dental technician is completing a procedure on a patient .|1
2657643451.jpg|0| A person runs a with dog .| A person runs with a dog .|1
234249498.jpg|0| performing Singers to the crowd .| Singers performing to the crowd .|1
4439029503.jpg|0| A woman is walking in winter with a cart of groceries .| A woman is walking in winter with a cart of groceries .|0
241347243.jpg|0| The Sooners quarterback is waiting for the snap from his center .| The Sooners quarterback is waiting for the snap from his center .|0
6879494312.jpg|0| A musician dressed in a suit plays his large instrument while sitting on an amplifier .| A musician dressed in a suit plays his large instrument while sitting on an amplifier .|0
5275330163.jpg|0| Hands painted with red nail holding polish a nail polish bottle 745 .| Hands painted with red nail polish holding a nail polish bottle 745 .|1
4057128396.jpg|0| Woman with face on mask is holding a baby swaddled in white .| Woman with face mask on is holding a baby swaddled in white .|1
2355880294.jpg|0| Two athletic men climbing a waterfall .| Two athletic men climbing a waterfall .|0
2531794051.jpg|0| Indian man sitting in the street doing some sort of metal working , tools around him .| Indian man sitting in the street doing some sort of metal working , tools around him .|0
3495453699.jpg|0| The man is posing in front of a small child near a light post .| The man is posing in front of a small child near a light post .|0
5445530361.jpg|0| men Two are traveling in a canoe .| Two men are traveling in a canoe .|1
5432374521.jpg|0| Large groups of families in gather an outdoor courtyard to pray for rain .| Large groups of families gather in an outdoor courtyard to pray for rain .|1
7567712136.jpg|0| A silhouette of a man and woman stand in front of a wall of fire .| A silhouette of a man and woman stand in front of a wall of fire .|0
3631023049.jpg|0| Three children play in a large bowl shaped swing .| Three children play in a large bowl shaped swing .|0
3353036763.jpg|0| two guy standing on horses , while a crowd watches| two guy standing on horses , while a crowd watches|0
3498914375.jpg|0| Man and women on sitting tree posing for picture .| Man and women sitting on tree posing for picture .|1
3116412402.jpg|0| A woman in ethnic clothes looks like she is dancing .| A woman in ethnic clothes looks like she is dancing .|0
194197375.jpg|0| Some men are sitting on a boat near a beach covered in stacked logs and sticks .| Some men are sitting on a boat near a beach covered in stacked logs and sticks .|0
3215315009.jpg|0| The rider is his jumping BMX bike .| The rider is jumping his BMX bike .|1
4621091937.jpg|0| gentlemen The wait not speaking to one another .| The gentlemen wait not speaking to one another .|1
3148193539.jpg|0| Three boys climb on a slide| Three boys climb on a slide|0
2229571601.jpg|0| A man is waiting for a bus at the bus stop| A man is waiting for a bus at the bus stop|0
452345346.jpg|0| A bull terrier terrorizes an old in tire the sand .| A bull terrier terrorizes an old tire in the sand .|1
4935946626.jpg|0| Two people in walking front of a graffiti wall .| Two people walking in front of a graffiti wall .|1
4907785038.jpg|0| A little girl runs across a green field grassy .| A little girl runs across a green grassy field .|1
4911020894.jpg|0| Two children sit side by side while a eating treat .| Two children sit side by side while eating a treat .|1
4556128862.jpg|0| A man crazy with eyes in a fedora has his guitar looked at .| A man with crazy eyes in a fedora has his guitar looked at .|1
20702864.jpg|0| construction Two workers working in the middle of a city .| Two construction workers working in the middle of a city .|1
2502905671.jpg|0| A black and white dog looks a at man about to throw something .| A black and white dog looks at a man about to throw something .|1
100845130.jpg|0| Four silhouettes decorate the horizon 's sunset .| Four silhouettes decorate the horizon 's sunset .|0
50766676.jpg|0| Two boys wearing white karate uniforms are engaging in sparring .| Two boys wearing white karate uniforms are engaging in sparring .|0
450518960.jpg|0| Two young women run on a track surrounded by foliage .| Two young women run on a track surrounded by foliage .|0
5571949283.jpg|0| Older man his baiting hook before tossing it out to see what he can catch| Older man baiting his hook before tossing it out to see what he can catch|1
579055546.jpg|0| Little boy standing under a tree in the park after throwing Frisbee a .| Little boy standing under a tree in the park after throwing a Frisbee .|1
6773067336.jpg|0| Asian school children listen to their teacher talking .| Asian school children listen to their teacher talking .|0
1174525839.jpg|0| girls The is jumping into the air on the beach .| The girls is jumping into the air on the beach .|1
4037734292.jpg|0| A man in lies a crowded street while people walk by oblivious to him .| A man lies in a crowded street while people walk by oblivious to him .|1
1141739219.jpg|0| A girl climbing down from the side of a bright blue truck while others watch .| A girl climbing down from the side of a bright blue truck while others watch .|0
3631333167.jpg|0| A crowd of people singing with four green strobe lights shining the in background .| A crowd of people singing with four green strobe lights shining in the background .|1
6243067522.jpg|0| Two women dressed in black are leaning backwards on tables of white .| Two women dressed in black are leaning backwards on tables of white .|0
4494282798.jpg|0| A woman in a bikini holding a pamphlet .| A woman in a bikini holding a pamphlet .|0
3339861543.jpg|0| a group of people surrounded at a dinner table| a group of people surrounded at a dinner table|0
28318358.jpg|0| Children getting by sprayed water in a parking lot .| Children getting sprayed by water in a parking lot .|1
870186901.jpg|0| A man his rubbing hands on some type of metal object| A man rubbing his hands on some type of metal object|1
416568642.jpg|0| A young girl looks up at an adult as tries she to swing on a public playground .| A young girl looks up at an adult as she tries to swing on a public playground .|1
4798886213.jpg|0| A woman wearing a hooded jacket over a striped sweater is rollerskating with other people .| A woman wearing a hooded jacket over a striped sweater is rollerskating with other people .|0
1453366750.jpg|0| children Two are shown upside down .| Two children are shown upside down .|1
6980999098.jpg|0| While a lady digging a deep hole in the sandy beach , two children watching her .| While a lady digging a deep hole in the sandy beach , two children watching her .|0
2633201394.jpg|0| Dog is swimming through water with a of piece wood in its mouth .| Dog is swimming through water with a piece of wood in its mouth .|1
475120887.jpg|0| A woman wearing black and red is playing a violin in street the .| A woman wearing black and red is playing a violin in the street .|1
196583746.jpg|0| Three painters painting are the railings of a pier .| Three painters are painting the railings of a pier .|1
3023339840.jpg|0| A room full of people with a black kid showing a piece of art .| A room full of people with a black kid showing a piece of art .|0
5371586024.jpg|0| Two women stand near a large mixer as they dough prepare .| Two women stand near a large mixer as they prepare dough .|1
2333712689.jpg|0| A man wearing a blue shit is standing up speaking .| A man wearing a blue shit is standing up speaking .|0
7456119772.jpg|0| A person wearing goggles with a white strap and short blond-hair swims in a pool .| A person wearing goggles with a white strap and short blond-hair swims in a pool .|0
4533797732.jpg|0| A man posing with a "" November ca n't come soon enough "" poster .| A man posing with a "" November ca n't come soon enough "" poster .|0
3992703753.jpg|0| Group of young adults posing for picture near spanish-language sign .| Group of young adults posing for picture near spanish-language sign .|0
3228793611.jpg|0| A large brown dog is digging in the sand .| A large brown dog is digging in the sand .|0
6082535291.jpg|0| people many rollerskating| many people rollerskating|1
2603743747.jpg|0| Two men re-tarring a roof on a sunny day .| Two men re-tarring a roof on a sunny day .|0
68897277.jpg|0| A girl laughing and a girl looking away .| A girl laughing and a girl looking away .|0
2193223637.jpg|0| old An woman walks across the street with a cane .| An old woman walks across the street with a cane .|1
174040619.jpg|0| A adult lively karate practice at the dojo .| A lively adult karate practice at the dojo .|1
404491917.jpg|0| Someone is swimming in a pool .| Someone is swimming in a pool .|0
3897974076.jpg|0| Two children a and woman climb up the stairs on a metal electric pole-like structure .| Two children and a woman climb up the stairs on a metal electric pole-like structure .|1
4794460787.jpg|0| The little girl is watching the lady the on ground .| The little girl is watching the lady on the ground .|1
2491261614.jpg|0| Three men are on working a home improvement project .| Three men are working on a home improvement project .|1
4631421666.jpg|0| Person in bear costume has taken off mask in public .| Person in bear costume has taken off mask in public .|0
4103236953.jpg|0| Many are kids sitting and taking notes .| Many kids are sitting and taking notes .|1
576920249.jpg|0| A girl raises her hands up in a crowd of people .| A girl raises her hands up in a crowd of people .|0
2832747707.jpg|0| A horse and rider jumping tall rails positioned over a replica stone , bridge arch-style .| A horse and rider jumping tall rails positioned over a replica stone , arch-style bridge .|1
5445317867.jpg|0| A crowd watches a many on a bicycle performing a stunt .| A crowd watches a many on a bicycle performing a stunt .|0
3295418287.jpg|0| A chinese festival .| A chinese festival .|0
3534172926.jpg|0| A play wooden ship that children can climb on and play in .| A play wooden ship that children can climb on and play in .|0
15874606.jpg|0| A young boy is swimming a in pool .| A young boy is swimming in a pool .|1
6617071067.jpg|0| A skateboarder flips his board over steps some in a plaza .| A skateboarder flips his board over some steps in a plaza .|1
3174771296.jpg|0| A oriental person rowing a boat , full of vegetables , down a river .| A oriental person rowing a boat , full of vegetables , down a river .|0
6309782007.jpg|0| two men drinking beer with another in the background .| two men drinking beer with another in the background .|0
4855810908.jpg|0| Seven kids are sitting around in a circle fixing their bikes .| Seven kids are sitting around in a circle fixing their bikes .|0
44129946.jpg|0| A man and woman sit on a bench , watching a boat go by .| A man and woman sit on a bench , watching a boat go by .|0
3186073578.jpg|0| A man is walking down the holding street up a picture .| A man is walking down the street holding up a picture .|1
3595956590.jpg|0| A young girl smiles and sticks her thumb up while posing in front of a turtle .| A young girl smiles and sticks her thumb up while posing in front of a turtle .|0
8213661428.jpg|0| long-haired A man belts out a tune on a trumpet while accompanying his band .| A long-haired man belts out a tune on a trumpet while accompanying his band .|1
3827302666.jpg|0| A woman in a black dress sitting in of front a table of wares .| A woman in a black dress sitting in front of a table of wares .|1
4480270643.jpg|0| A man in standing a strange building is looking out a window at the water .| A man standing in a strange building is looking out a window at the water .|1
6965582571.jpg|0| A hand with a ring touching a piece of blue material under a light .| A hand with a ring touching a piece of blue material under a light .|0
2566970328.jpg|0| Two girls sitting on a chair being sketched .| Two girls sitting on a chair being sketched .|0
6213858694.jpg|0| Two women bumping into each other during a roller derby game .| Two women bumping into each other during a roller derby game .|0
3328397409.jpg|0| man A is snowboarding over a pipe .| A man is snowboarding over a pipe .|1
4289221907.jpg|0| Nine female dancers wear tutus and use "" Guitar Hero "" guitars as a on prop stage .| Nine female dancers wear tutus and use "" Guitar Hero "" guitars as a prop on stage .|1
2530468893.jpg|0| person A dressed in an orange uniform walking towards two women .| A person dressed in an orange uniform walking towards two women .|1
2871134110.jpg|0| A boy shovels into manure a fire while a man looks towards the camera .| A boy shovels manure into a fire while a man looks towards the camera .|1
1295698260.jpg|0| The woman in glasses is holding a red and white sale bag .| The woman in glasses is holding a red and white sale bag .|0
194433740.jpg|0| A young man woman and sitting in the backseat of a car smile at the camera .| A young man and woman sitting in the backseat of a car smile at the camera .|1
241346471.jpg|0| Football players are tackling a football player the carrying football .| Football players are tackling a football player carrying the football .|1
2365175507.jpg|0| A track athlete is jumping a hurdle .| A track athlete is jumping a hurdle .|0
42397423.jpg|0| A young boy walks a on pipe that stretches over water .| A young boy walks on a pipe that stretches over water .|1
4836132337.jpg|0| Large green lawn with a man and a building in the background .| Large green lawn with a man and a building in the background .|0
4705366381.jpg|0| Three women are outdoors praying| Three women are outdoors praying|0
4796732957.jpg|0| A man young with a backpack and blue sunglasses is crossing the street .| A young man with a backpack and blue sunglasses is crossing the street .|1
3030823649.jpg|0| a dog runs for the tennis ball .| a dog runs for the tennis ball .|0
6075404518.jpg|0| A woman stands behind the cash register of White Castle waiting to money accept .| A woman stands behind the cash register of White Castle waiting to accept money .|1
4622921215.jpg|0| A taxi cab with a lot of around people the street .| A taxi cab with a lot of people around the street .|1
3187924573.jpg|0| A white bird has something in its beak at it lands on the water .| A white bird has something in its beak at it lands on the water .|0
4463424891.jpg|0| A young boy walking through courtyard the of ruined buildings .| A young boy walking through the courtyard of ruined buildings .|1
3824938721.jpg|0| Patriotic band is playing music for onlookers .| Patriotic band is playing music for onlookers .|0
4313255436.jpg|0| Person in black about to jog under a bridge .| Person in black about to jog under a bridge .|0
76485985.jpg|0| Two young girls dressed in pink reach into fountain wishing at mall .| Two young girls dressed in pink reach into wishing fountain at mall .|1
4717504849.jpg|0| Food is prepared in an open air market .| Food is prepared in an open air market .|0
3722809335.jpg|0| A white male with a black hat and blue shirt sitting a on fence playing a guitar| A white male with a black hat and blue shirt sitting on a fence playing a guitar|1
3930187102.jpg|0| A man standing in a green box .| A man standing in a green box .|0
2711802560.jpg|0| A girl little standing in the middle of a street cleared for an oncoming parade .| A little girl standing in the middle of a street cleared for an oncoming parade .|1
3149894951.jpg|0| A man is dressed in a costume in front several of goats .| A man is dressed in a costume in front of several goats .|1
285586547.jpg|0| man A on a motorcycle rides with a dog| A man on a motorcycle rides with a dog|1
521292795.jpg|0| Two in girls costumes sit on a sidewalk .| Two girls in costumes sit on a sidewalk .|1
2768397923.jpg|0| A man a in striped shirt smiling .| A man in a striped shirt smiling .|1
128395625.jpg|0| Two people are riding bicycles to next a building .| Two people are riding bicycles next to a building .|1
2408570692.jpg|0| A group of woman discussing the artwork as they for wait the train .| A group of woman discussing the artwork as they wait for the train .|1
394508043.jpg|0| Young man wearing a blue helmet and riding an ATV through the mud .| Young man wearing a blue helmet and riding an ATV through the mud .|0
423167388.jpg|0| A camera crew is filming an older gentlemen wearing long a gray coat .| A camera crew is filming an older gentlemen wearing a long gray coat .|1
3498417123.jpg|0| A rugby match in progress is shown with the referee watching .| A rugby match in progress is shown with the referee watching .|0
4665584226.jpg|0| A man and a woman look to their left near a liquor store .| A man and a woman look to their left near a liquor store .|0
2517284816.jpg|0| Middle school aged kids are showing their school spirit at pep a rally .| Middle school aged kids are showing their school spirit at a pep rally .|1
4943870853.jpg|0| Three men sitting the on curb in front of a convenience store .| Three men sitting on the curb in front of a convenience store .|1
402978771.jpg|0| A girl in a striped blouse sits on a bench near a pay phone .| A girl in a striped blouse sits on a bench near a pay phone .|0
437230706.jpg|0| A child looks a at lizard in another child 's hand .| A child looks at a lizard in another child 's hand .|1
3822007440.jpg|0| Six Buddhist boys walk along the side of a road in orange traditional monk robes .| Six Buddhist boys walk along the side of a road in traditional orange monk robes .|1
4784654965.jpg|0| Woman in shorts and t-shirt standing by some seated men and a watching performance or speaker .| Woman in shorts and t-shirt standing by some seated men and watching a performance or speaker .|1
4488874349.jpg|0| Men in some Christian order marching in procession down a street .| Men in some Christian order marching in procession down a street .|0
250892549.jpg|0| Two dogs in grassy a park playing .| Two dogs in a grassy park playing .|1
3706019147.jpg|0| A boat full of Asian people is sailed through reeds and bushes .| A boat full of Asian people is sailed through reeds and bushes .|0
482088914.jpg|0| A kayaker almost turns over .| A kayaker almost turns over .|0
4199835945.jpg|0| A man and a woman walking are arm in arm up steps .| A man and a woman are walking arm in arm up steps .|1
106372282.jpg|0| Two men relaxing in a bakery| Two men relaxing in a bakery|0
2244613488.jpg|0| three bikers bike the across dry land .| three bikers bike across the dry land .|1
6199755897.jpg|0| Marathon are runners running down a street with motorcyclists nearby .| Marathon runners are running down a street with motorcyclists nearby .|1
1481728325.jpg|0| Coordinated playing youths orchestral instruments .| Coordinated youths playing orchestral instruments .|1
2231245129.jpg|0| A man is swinging his racket as he plays a tennis match .| A man is swinging his racket as he plays a tennis match .|0
4946986337.jpg|0| 2 young men in white tank tops and basketball shorts , one holding a basketball .| 2 young men in white tank tops and basketball shorts , one holding a basketball .|0
4435179084.jpg|0| this is a of group people participating in a race| this is a group of people participating in a race|1
495054019.jpg|0| Three young men sprinting past their coach outside .| Three young men sprinting past their coach outside .|0
63787714.jpg|0| Three jockeys mounted on horses ride in race .| Three jockeys mounted on horses ride in race .|0
3370340289.jpg|0| Two people wearing black jacket and blue jean stand facing opposite directions .| Two people wearing black jacket and blue jean stand facing opposite directions .|0
3789230623.jpg|0| Two men down bent in front of a brick wall .| Two men bent down in front of a brick wall .|1
3395053439.jpg|0| A team of players the middle of a football game .| A team of players the middle of a football game .|0
2568417021.jpg|0| A youn man in front of a white house holding blue and red basketball .| A youn man in front of a white house holding blue and red basketball .|0
429499185.jpg|0| Three people giving a presentation before a crowd .| Three people giving a presentation before a crowd .|0
3559781965.jpg|0| A brown greyhound is wearing a blue muzzle and blue collar .| A brown greyhound is wearing a blue muzzle and blue collar .|0
3893946197.jpg|0| Two bikers biking by a yellow field .| Two bikers biking by a yellow field .|0
3081734118.jpg|0| a brown and white dog has is mouth open ready catch to a green ball .| a brown and white dog has is mouth open ready to catch a green ball .|1
4941680934.jpg|0| Man with a weapon lying against a wall .| Man with a weapon lying against a wall .|0
4700695576.jpg|0| Pedestrians are waiting to cross the street at a crosswalk .| Pedestrians are waiting to cross the street at a crosswalk .|0
4843297992.jpg|0| People like dressed furry animals walk the streets on a rainy day .| People dressed like furry animals walk the streets on a rainy day .|1
2914160252.jpg|0| Young boy drops from rings in gymnastic class .| Young boy drops from rings in gymnastic class .|0
2617216530.jpg|0| A barefoot woman with tattoos on her shoulders in shopping a grocery store .| A barefoot woman with tattoos on her shoulders shopping in a grocery store .|1
2659046789.jpg|0| A young man part taking in a pie eating contest .| A young man taking part in a pie eating contest .|1
2942094037.jpg|0| A little girl with her hair flying up in the air on an air-filled toy .| A little girl with her hair flying up in the air on an air-filled toy .|0
3605100550.jpg|0| The larger dog is barking at the smaller dog .| The larger dog is barking at the smaller dog .|0
4590720793.jpg|0| Two women dressed in animal prints are playing percussion instruments .| Two women dressed in animal prints are playing percussion instruments .|0
1287768104.jpg|0| A woman in a black shirt is hugging a man .| A woman in a black shirt is hugging a man .|0
3812719670.jpg|0| A child stares down over a group of people who are around a bonfire .| A child stares down over a group of people who are around a bonfire .|0
4552608823.jpg|0| A group of people standing in a courtyard looking up at people out on balconies above .| A group of people standing in a courtyard looking up at people out on balconies above .|0
4874913189.jpg|0| Two puppies are sitting together next to a bike on black tiled flooring .| Two puppies are sitting together next to a bike on black tiled flooring .|0
2826030193.jpg|0| The child in the red coat laid in the red mat .| The child in the red coat laid in the red mat .|0
135911244.jpg|0| Two officers in uniform chatting in golf a cart .| Two officers in uniform chatting in a golf cart .|1
2875605750.jpg|0| Woman wearing black and washing windows .| Woman wearing black and washing windows .|0
4448569088.jpg|0| People at a party standing around an illuminated fountain .| People at a party standing around an illuminated fountain .|0
4971478897.jpg|0| A little girl is standing in between two men in what looks like a store room .| A little girl is standing in between two men in what looks like a store room .|0
461019788.jpg|0| Two people embrace on the end of a dock .| Two people embrace on the end of a dock .|0
5820828817.jpg|0| A blond little girl looks through a pair of green binoculars .| A blond little girl looks through a pair of green binoculars .|0
3151898976.jpg|0| Two small children are talking in a in field front of a yellow caution tape .| Two small children are talking in a field in front of a yellow caution tape .|1
3298573714.jpg|0| A woman walking her dog along a street of residences .| A woman walking her dog along a street of residences .|0
8125199349.jpg|0| A young barefoot boy is petting a cat on a trail in the woods .| A young barefoot boy is petting a cat on a trail in the woods .|0
1315402173.jpg|0| A young boy examines a field of pumpkins , with some already in his wheelbarrow .| A young boy examines a field of pumpkins , with some already in his wheelbarrow .|0
6977288802.jpg|0| A man is using a cutting board to food chop .| A man is using a cutting board to chop food .|1
4822404949.jpg|0| A man sitting at a computer hides his face from a little boy in a gray shirt .| A man sitting at a computer hides his face from a little boy in a gray shirt .|0
2788933694.jpg|0| A girl with a blue shirt using a with telescope two friends .| A girl with a blue shirt using a telescope with two friends .|1
5648957534.jpg|0| Village person is picking vegetables from the ground .| Village person is picking vegetables from the ground .|0
7325893298.jpg|0| A man surfing on a wave with a few people behind him swimming .| A man surfing on a wave with a few people behind him swimming .|0
4153140979.jpg|0| a man in blue sitting on a machine working .| a man in blue sitting on a machine working .|0
3284695268.jpg|0| A blond toddler in puffy a jacket sits at the top of a blue slide .| A blond toddler in a puffy jacket sits at the top of a blue slide .|1
3590753142.jpg|0| Three people on standing boardwalk looking at buildings across the water .| Three people standing on boardwalk looking at buildings across the water .|1
1600208439.jpg|0| A dog enjoys playing in the water at the edge of field a .| A dog enjoys playing in the water at the edge of a field .|1
3595643050.jpg|0| A dog jumping up in the air next to a white house .| A dog jumping up in the air next to a white house .|0
3353328134.jpg|0| A skier on red skis is upside flipping down between two trees .| A skier on red skis is flipping upside down between two trees .|1
