image_name|comment_number|comment|original|target
4618885426.jpg|0| Two young children play a on sandy beach .| Two young children play on a sandy beach .|1
244443352.jpg|0| brown A dog has his face down in the snow .| A brown dog has his face down in the snow .|1
7396385574.jpg|0| The lead singer visited with his band members and had the guitarist sing along with the song .| The lead singer visited with his band members and had the guitarist sing along with the song .|0
161329629.jpg|0| A group of dressed people in Renaissance-era clothing converse .| A group of people dressed in Renaissance-era clothing converse .|1
1509274237.jpg|0| girl A in a plaid dress is walking on a sidewalk next to a stone building .| A girl in a plaid dress is walking on a sidewalk next to a stone building .|1
3226796100.jpg|0| A child small practices golf .| A small child practices golf .|1
3039209547.jpg|0| A man in brown pants has his picture enlarged and stretched .| A man in brown pants has his picture enlarged and stretched .|0
6545713889.jpg|0| A and man another person are playing in the snow .| A man and another person are playing in the snow .|1
2236059848.jpg|0| There are red balloons an inside eating establishment .| There are red balloons inside an eating establishment .|1
3628564816.jpg|0| Several people walk in a pedestrian shopping street .| Several people walk in a pedestrian shopping street .|0
2481968683.jpg|0| There are a group of around people a heard of sheep .| There are a group of people around a heard of sheep .|1
4972988789.jpg|0| A man in crouches front of a yellow wall .| A man crouches in front of a yellow wall .|1
6788553859.jpg|0| Hockey making goalie a save .| Hockey goalie making a save .|1
3560620846.jpg|0| A person is hanging on a wet ledge above a waterfall , looking down below him .| A person is hanging on a wet ledge above a waterfall , looking down below him .|0
513269597.jpg|0| A furry dog is walking by green trees while carrying something in its mouth .| A furry dog is walking by green trees while carrying something in its mouth .|0
7027910155.jpg|0| Two girls are putting a chemical in a bottle .| Two girls are putting a chemical in a bottle .|0
3230432495.jpg|0| A boy in white shorts stands on a rusty tower .| A boy in white shorts stands on a rusty tower .|0
449687289.jpg|0| A girl in a blue shirt playing her electric guitar on stage .| A girl in a blue shirt playing her electric guitar on stage .|0
3061422245.jpg|0| person A carrying many bags .| A person carrying many bags .|1
4739645879.jpg|0| A blond woman in a white cutoff shirt and jeans is walking .| A blond woman in a white cutoff shirt and jeans is walking .|0
4789374589.jpg|0| An Asian woman looks out a car window at a cat sitting the in road .| An Asian woman looks out a car window at a cat sitting in the road .|1
3282832381.jpg|0| A small boy is playing with a laundry basket on his head .| A small boy is playing with a laundry basket on his head .|0
4805120667.jpg|0| a group of friends gathered together for little a fun with sodas and blowing bubbles .| a group of friends gathered together for a little fun with sodas and blowing bubbles .|1
43244430.jpg|0| People enjoying a festival while having drinks and pictures taking on the cellphone .| People enjoying a festival while having drinks and taking pictures on the cellphone .|1
1508269285.jpg|0| A dog with brown spots , standing at the shore of a lake .| A dog with brown spots , standing at the shore of a lake .|0
2911107495.jpg|0| Boy skating on a railing in a parking lot .| Boy skating on a railing in a parking lot .|0
2993318965.jpg|0| A family is standing under very a large tree .| A family is standing under a very large tree .|1
2261264620.jpg|0| A red-haired man shaving his lathered jaw with a razor .| A red-haired man shaving his lathered jaw with a razor .|0
347922862.jpg|0| A man is pulling two children on a sled in the snow behind other people .| A man is pulling two children on a sled in the snow behind other people .|0
2685343089.jpg|0| A wet child enjoys the summer .| A wet child enjoys the summer .|0
156249400.jpg|0| Two are soldiers playing baseball and touching the base .| Two soldiers are playing baseball and touching the base .|1
3222702477.jpg|0| Yellow team and Blue team racing to the soccer ball .| Yellow team and Blue team racing to the soccer ball .|0
614590294.jpg|0| A large group of people sitting on a pier a overlooking lake .| A large group of people sitting on a pier overlooking a lake .|1
3277162496.jpg|0| dogs three playing together in a grassy field with trees in the background| three dogs playing together in a grassy field with trees in the background|1
4581195263.jpg|0| A boy and a girl are petting a cow through a fence .| A boy and a girl are petting a cow through a fence .|0
2723785828.jpg|0| Two small boys with painted faces are sitting next to each other .| Two small boys with painted faces are sitting next to each other .|0
2533076864.jpg|0| An elderly woman recyclable collects trash .| An elderly woman collects recyclable trash .|1
4983722231.jpg|0| A view of the back of a woman having a beverage .| A view of the back of a woman having a beverage .|0
2943079526.jpg|0| A businessman is reading on a subway| A businessman is reading on a subway|0
3577928139.jpg|0| boy A is playing warning device .| A boy is playing warning device .|1
3896057129.jpg|0| a man is playing accordion the on the sidewalk in front of a store .| a man is playing the accordion on the sidewalk in front of a store .|1
157747588.jpg|0| A group of people are standing around a water fountain getting wet .| A group of people are standing around a water fountain getting wet .|0
4713532955.jpg|0| The man with the bag is standing on the corner .| The man with the bag is standing on the corner .|0
514990193.jpg|0| poses Girl on couch on suburban lawn .| Girl poses on couch on suburban lawn .|1
2579625460.jpg|0| A of member the military that is holding a gun and sitting on top of a vehicle .| A member of the military that is holding a gun and sitting on top of a vehicle .|1
2071705189.jpg|0| A little girl is walking over a path of numbers .| A little girl is walking over a path of numbers .|0
3051998298.jpg|0| A guy in navy blue and yellow shorts jumping a into pool .| A guy in navy blue and yellow shorts jumping into a pool .|1
3665441862.jpg|0| A little girl pink in climbing a fence .| A little girl in pink climbing a fence .|1
4980100317.jpg|0| An African American brightly in colored clothing talks on a cellphone on a busy street .| An African American in brightly colored clothing talks on a cellphone on a busy street .|1
8107925709.jpg|0| Bicyclists wearing smiles on ride a sunny day in an urban landscape .| Bicyclists wearing smiles ride on a sunny day in an urban landscape .|1
4324771398.jpg|0| A bored-looking girl relaxes the in park .| A bored-looking girl relaxes in the park .|1
3356938707.jpg|0| Two men wearing eyeglasses standing together .| Two men wearing eyeglasses standing together .|0
7177860808.jpg|0| Hmong mother her washing children 's clothes with beautiful scenery behind her .| Hmong mother washing her children 's clothes with beautiful scenery behind her .|1
5767811093.jpg|0| A batter swings as the ball in comes !| A batter swings as the ball comes in !|1
3503689049.jpg|0| a young man wearing dark sunglasses smiling| a young man wearing dark sunglasses smiling|0
2978271431.jpg|0| a few different small cars racing around a track in the rain| a few different small cars racing around a track in the rain|0
7348157814.jpg|0| A jockey wearing red rides a horse over a green lush grassy area .| A jockey wearing red rides a horse over a lush green grassy area .|1
3342952175.jpg|0| A boy is going down the slide .| A boy is going down the slide .|0
4486440297.jpg|0| A stern woman passing a man in a town square .| A stern woman passing a man in a town square .|0
3409947123.jpg|0| game The booths at a carnival are shown with a doughnut shop in the background .| The game booths at a carnival are shown with a doughnut shop in the background .|1
3815075229.jpg|0| A man in an orange shirt is the passenger of a green car .| A man in an orange shirt is the passenger of a green car .|0
3215695965.jpg|0| A boy sits a inside shopping cart .| A boy sits inside a shopping cart .|1
876493846.jpg|0| A person wearing some of sort scarf on their head while sewing .| A person wearing some sort of scarf on their head while sewing .|1
2415326086.jpg|0| Several people walking down a walkway .| Several people walking down a walkway .|0
1403857072.jpg|0| There 's two men on typing a computer .| There 's two men typing on a computer .|1
5290994547.jpg|0| A guy fixing a computer part turning to look at the one who is taking his picture .| A guy fixing a computer part turning to look at the one who is taking his picture .|0
643684227.jpg|0| Three Japanese men fishing from boat wooden .| Three Japanese men fishing from wooden boat .|1
4926115712.jpg|0| A man and old woman is playing a game| A man and old woman is playing a game|0
2789937754.jpg|0| An overweight family with sling bags across stand near a group of people .| An overweight family with sling across bags stand near a group of people .|1
2460467896.jpg|0| An orange crane tearing down part of a wall .| An orange crane tearing down part of a wall .|0
4563544127.jpg|0| An older man holds a sign tattoos advertising .| An older man holds a sign advertising tattoos .|1
5691273582.jpg|0| A man mopping the floor in front of an amusement park ride .| A man mopping the floor in front of an amusement park ride .|0
5637361857.jpg|0| A young man recreates a classical painting in a museum as an older gentleman views the original .| A young man recreates a classical painting in a museum as an older gentleman views the original .|0
3580941967.jpg|0| A girl is sitting on a bus .| A girl is sitting on a bus .|0
410042380.jpg|0| a woman sitting on a large brown couch in the middle of a mall| a woman sitting on a large brown couch in the middle of a mall|0
5821457818.jpg|0| A man is feeding some white geese in a river or lake .| A man is feeding some white geese in a river or lake .|0
4631265529.jpg|0| Sidewalk artist relaxing on stoop the after a hard day at the office .| Sidewalk artist relaxing on the stoop after a hard day at the office .|1
3054989420.jpg|0| Children tossing dead leaves on lawn .| Children tossing dead leaves on lawn .|0
2064841667.jpg|0| Young girl wearing holding white colorful paper by her mouth .| Young girl wearing white holding colorful paper by her mouth .|1
7663275698.jpg|0| Two guys playing basketball both midair one blocking while the other is attempting a jump shot .| Two guys playing basketball both midair one blocking while the other is attempting a jump shot .|0
6294582746.jpg|0| A woman in a black and red accented outfit is running across a bridge in nature .| A woman in a black and red accented outfit is running across a bridge in nature .|0
3827317206.jpg|0| A woman wearing a hat with making bread .| A woman wearing a hat with making bread .|0
6853913173.jpg|0| A group of people dressed in swimwear standing outside in a snowy , woodsy location .| A group of people dressed in swimwear standing outside in a snowy , woodsy location .|0
370713359.jpg|0| People are in sitting a cheery Mexican restaurant .| People are sitting in a cheery Mexican restaurant .|1
2785108434.jpg|0| A little kid jumps up into the air above the ocean .| A little kid jumps up into the air above the ocean .|0
4889481566.jpg|0| A woman plays her outside violin .| A woman plays her violin outside .|1
3903603264.jpg|0| A man singing on stage with a female musician accompanying .| A man singing on stage with a female musician accompanying .|0
4558167404.jpg|0| A man and woman cross street the .| A man and woman cross the street .|1
3119174449.jpg|0| A male photographer a takes picture of a pond .| A male photographer takes a picture of a pond .|1
289262112.jpg|0| Two spanish men in karate white garb sparring in a competition .| Two spanish men in white karate garb sparring in a competition .|1
3643807095.jpg|0| Two men in flaming shirts accented wrangling a large black cow .| Two men in flaming accented shirts wrangling a large black cow .|1
7438344154.jpg|0| A girl soccer player about to score a goal for her team .| A girl soccer player about to score a goal for her team .|0
4817120926.jpg|0| Two men are riding on a and white blue motorcycle .| Two men are riding on a white and blue motorcycle .|1
364282261.jpg|0| A man cleaning the floor in an empty room| A man cleaning the floor in an empty room|0
4175080701.jpg|0| Six people in hard hats are walking through the snow .| Six people in hard hats are walking through the snow .|0
2341283462.jpg|0| Three people are attending an event .| Three people are attending an event .|0
4845816601.jpg|0| A woman wearing a hat white and shirt stands near debris on wet sand near the water .| A woman wearing a white hat and shirt stands near debris on wet sand near the water .|1
3587941206.jpg|0| Boy baseball plays .| Boy plays baseball .|1
3669056658.jpg|0| A man is using his finger to draw something on the next sand to a kid .| A man is using his finger to draw something on the sand next to a kid .|1
3090600019.jpg|0| A man and a woman dressed as a prisoner and sexy police officer .| A man and a woman dressed as a prisoner and sexy police officer .|0
4791513183.jpg|0| A small girl in pink is standing in a large doorway .| A small girl in pink is standing in a large doorway .|0
3926139835.jpg|0| Two firefighters stand watch on a street in front of an urban building .| Two firefighters stand watch on a street in front of an urban building .|0
4933865159.jpg|0| looking Odd men dressed in white suite and blue hats standing in formation in the street .| Odd looking men dressed in white suite and blue hats standing in formation in the street .|1
4174186497.jpg|0| An older lady show a watch to a man standing next to her .| An older lady show a watch to a man standing next to her .|0
3368607300.jpg|0| Men putting together some sort of device .| Men putting together some sort of device .|0
4443084131.jpg|0| Several people on the subway reading newspaper the .| Several people on the subway reading the newspaper .|1
1006452823.jpg|0| Two kids on sit a seesaw .| Two kids sit on a seesaw .|1
3371112436.jpg|0| A man tying his shoe at a beach .| A man tying his shoe at a beach .|0
156222796.jpg|0| A few baby 's in strollers wondering lots of things .| A few baby 's in strollers wondering lots of things .|0
7061176565.jpg|0| Young women in the street wearing headscarves .| Young women in the street wearing headscarves .|0
2407470303.jpg|0| Dog in foreground with people three in background .| Dog in foreground with three people in background .|1
2911552402.jpg|0| A biker does trick a on a ramp .| A biker does a trick on a ramp .|1
281297361.jpg|0| An elderly woman in a tan coat and scarf tied around her head is standing outside .| An elderly woman in a tan coat and scarf tied around her head is standing outside .|0
3797123205.jpg|0| A lady with a blue coat is seen riding a in bike front of a store .| A lady with a blue coat is seen riding a bike in front of a store .|1
3719461451.jpg|0| A large very bird flying over water .| A very large bird flying over water .|1
3730011701.jpg|0| A little waist girls high in sand| A little girls waist high in sand|1
2185509485.jpg|0| Man in yellow shirt and jeans laying on the pavement .| Man in yellow shirt and jeans laying on the pavement .|0
3366105287.jpg|0| A boy wearing purple rides a skateboard up a ramp .| A boy wearing purple rides a skateboard up a ramp .|0
5632141892.jpg|0| A group of women in saris sit , talk and bathe together .| A group of women in saris sit , talk and bathe together .|0
3102204862.jpg|0| wrestler Professional getting flipped by another .| Professional wrestler getting flipped by another .|1
3421789737.jpg|0| The boy is standing on the playground equipment in the triangle blue .| The boy is standing on the playground equipment in the blue triangle .|1
2934359101.jpg|0| Man water spraying into boxer 's mouth .| Man spraying water into boxer 's mouth .|1
7233046630.jpg|0| man A is going down a river in a kayak .| A man is going down a river in a kayak .|1
3037410256.jpg|0| Three are women cultivating plants in a flooded riverbed .| Three women are cultivating plants in a flooded riverbed .|1
470887791.jpg|0| A man holding flag and a woman behind a railing .| A man holding flag and a woman behind a railing .|0
3290025108.jpg|0| a person cutting with machine cleaning the garden .| a person with cutting machine cleaning the garden .|1
3458211052.jpg|0| A line of spectators at a race .| A line of spectators at a race .|0
103195344.jpg|0| A man sitting in front of a metal sculpture in front of a building .| A man sitting in front of a metal sculpture in front of a building .|0
309777765.jpg|0| Three people are around a circular cutting board chopping food .| Three people are around a circular cutting board chopping food .|0
2969545002.jpg|0| people Two having a conversation outdoors .| Two people having a conversation outdoors .|1
4786170253.jpg|0| There is a very large crowd at the high school game .| There is a very large crowd at the high school game .|0
4917188600.jpg|0| Elderly people music performing in a street .| Elderly people performing music in a street .|1
3666169738.jpg|0| A small splashes baby in water| A small baby splashes in water|1
3323498985.jpg|0| A man is falling into waves .| A man is falling into waves .|0
3382777250.jpg|0| A is child looking at a red parking meter on the street .| A child is looking at a red parking meter on the street .|1
4958552471.jpg|0| An old man sleeps on grass the at the foot of a large tree .| An old man sleeps on the grass at the foot of a large tree .|1
3191805046.jpg|0| balances Snowboarder on low , wooden structure in snow .| Snowboarder balances on low , wooden structure in snow .|1
2797490755.jpg|0| One woman is helping woman another to her feet .| One woman is helping another woman to her feet .|1
8052328504.jpg|0| A young football player lands on his head while others in the background approach him .| A young football player lands on his head while others in the background approach him .|0
288025239.jpg|0| A person peeks out from a tent colorful in a vast field of snow .| A person peeks out from a colorful tent in a vast field of snow .|1
3161044966.jpg|0| A small white dog on jumps a chair| A small white dog jumps on a chair|1
2810289270.jpg|0| A doctor checks the heartbeat of a young girl .| A doctor checks the heartbeat of a young girl .|0
411175971.jpg|0| A brown dog is standing shown in the water near a muddy beach .| A brown dog is shown standing in the water near a muddy beach .|1
281754914.jpg|0| Boy in striped shirt standing among the tall grasses .| Boy in striped shirt standing among the tall grasses .|0
4744435567.jpg|0| Older man playing with child a .| Older man playing with a child .|1
1051953669.jpg|0| A little girl stands in a backyard , holding a toy and looking into the camera .| A little girl stands in a backyard , holding a toy and looking into the camera .|0
6250563782.jpg|0| A mother helps her daughter dress for a special occasion| A mother helps her daughter dress for a special occasion|0
23714402.jpg|0| People standing outside an airplane with Native American art painted on the tail .| People standing outside an airplane with Native American art painted on the tail .|0
1440024115.jpg|0| A man plays Frisbee with his dog .| A man plays Frisbee with his dog .|0
4592427648.jpg|0| A man asleep on a subway car .| A man asleep on a subway car .|0
7238675644.jpg|0| A child swings the bat to hit the ball off the T .| A child swings the bat to hit the ball off the T .|0
2456532329.jpg|0| An old man with blond-hair in a blue shirt and brown is hat playing an accordion .| An old man with blond-hair in a blue shirt and brown hat is playing an accordion .|1
98023274.jpg|0| A young child in red and black winter stands clothing near a stationary train .| A young child in red and black winter clothing stands near a stationary train .|1
3497485793.jpg|0| Two girls doing a presentation| Two girls doing a presentation|0
549998716.jpg|0| Four armed Israeli soldiers stand with a catholic priest .| Four armed Israeli soldiers stand with a catholic priest .|0
3322389758.jpg|0| The black dog is running through swampy a area with pieces of wood its mouth .| The black dog is running through a swampy area with pieces of wood its mouth .|1
4663418784.jpg|0| People are around sitting tables in a city square .| People are sitting around tables in a city square .|1
3183330562.jpg|0| Four kids next to a blue are house walking down a street .| Four kids next to a blue house are walking down a street .|1
3739833689.jpg|0| A young boy holds his head to baseball a bat on the green grass .| A young boy holds his head to a baseball bat on the green grass .|1
344205744.jpg|0| A couple sitting on a couch both make humorous faces .| A couple sitting on a couch both make humorous faces .|0
2729685399.jpg|0| three people standing near each other wearing coats with other people in the background| three people standing near each other wearing coats with other people in the background|0
4030623833.jpg|0| A man in a yellow helmet looks up , while people on the bridge watch .| A man in a yellow helmet looks up , while people on the bridge watch .|0
450746926.jpg|0| of Lots people in a farmers market shopping for fruits and vegetables .| Lots of people in a farmers market shopping for fruits and vegetables .|1
1084527029.jpg|0| Several Japanese motorcycles are lined up .| Several Japanese motorcycles are lined up .|0
8146641506.jpg|0| A man surveys a booth at a convention featuring framed art .| A man surveys a booth at a convention featuring framed art .|0
267593659.jpg|0| Men wearing lime green shirts work behind a chain link fence .| Men wearing lime green shirts work behind a chain link fence .|0
1459582913.jpg|0| A group of male and female cheerleaders create three formations .| A group of male and female cheerleaders create three formations .|0
7914606438.jpg|0| A man a in bicycle throws his hands up in victory as he crosses the finish line .| A man in a bicycle throws his hands up in victory as he crosses the finish line .|1
4985197970.jpg|0| A person is walking down a cobblestone street .| A person is walking down a cobblestone street .|0
4122645918.jpg|0| Kid in red shirt playing on bars while another boy watches .| Kid in red shirt playing on bars while another boy watches .|0
7523563426.jpg|0| Bruce Springsteen , dressed in black , holding is a microphone and pointing to a crowd .| Bruce Springsteen , dressed in black , is holding a microphone and pointing to a crowd .|1
2613209320.jpg|0| a long brown-haired dog walking through a river .| a long brown-haired dog walking through a river .|0
4966062401.jpg|0| A person in a statue of liberty costume with shades stands motionless in a crowd of people .| A person in a statue of liberty costume with shades stands motionless in a crowd of people .|0
6201592880.jpg|0| A woman wearing a red sports bra and black shorts is racing in a marathon .| A woman wearing a red sports bra and black shorts is racing in a marathon .|0
1329832826.jpg|0| Some people look to cross the street in front of a drug store .| Some people look to cross the street in front of a drug store .|0
4685031064.jpg|0| A group of soldiers are standing with in guns front of an armored vehicle .| A group of soldiers are standing with guns in front of an armored vehicle .|1
7157359077.jpg|0| A man , wearing glasses and a white shirt , lines up a billiards shot .| A man , wearing glasses and a white shirt , lines up a billiards shot .|0
2100909581.jpg|0| White dog playing in the snow .| White dog playing in the snow .|0
179717373.jpg|0| Two children are climbing the stairs into an airplane .| Two children are climbing the stairs into an airplane .|0
4535251327.jpg|0| A man in a gray investigating sweater an old tomb .| A man in a gray sweater investigating an old tomb .|1
2701892929.jpg|0| men Two dressed in martial arts outfits fight in an area while others in uniforms stand around .| Two men dressed in martial arts outfits fight in an area while others in uniforms stand around .|1
2774020195.jpg|0| Three little boys a play tugging game| Three little boys play a tugging game|1
536718060.jpg|0| A man wearing a blue shirt , standing on a ladder ; painting a building .| A man wearing a blue shirt , standing on a ladder ; painting a building .|0
139765126.jpg|0| A group of people outside after dark facing a waterway .| A group of people outside after dark facing a waterway .|0
2378791487.jpg|0| A man wearing a white tank top is perched and looking down from a rock .| A man wearing a white tank top is perched and looking down from a rock .|0
7114922111.jpg|0| Man wearing black is windsurfing .| Man wearing black is windsurfing .|0
55903788.jpg|0| A woman sits as another woman brushes out hair her .| A woman sits as another woman brushes out her hair .|1
8155663151.jpg|0| Youths dance together in a room dark with a British flag prominently displayed on the wall .| Youths dance together in a dark room with a British flag prominently displayed on the wall .|1
4503699216.jpg|0| standing Woman under blue umbrella| Woman standing under blue umbrella|1
1312954382.jpg|0| A girl wearing a green and orange dress walks on the street with a balloon .| A girl wearing a green and orange dress walks on the street with a balloon .|0
