image_name|comment_number|comment|original|target
5404607703.jpg|0| A boxer in red lands a glancing blow off of a boxer in white .| A boxer in red lands a glancing blow off of a boxer in white .|0
2369248869.jpg|0| A dog running through the water right toward the camera .| A dog running through the water right toward the camera .|0
2366306683.jpg|0| A man in a gray suit is in talking front of a microphone .| A man in a gray suit is talking in front of a microphone .|1
308539953.jpg|0| A local musician up on , stage playing guitar .| A local musician up on stage , playing guitar .|1
3632225464.jpg|0| A person hangs from ropes high in the air next to a building .| A person hangs from ropes high in the air next to a building .|0
3232734391.jpg|0| Three in men a band playing musical instruments .| Three men in a band playing musical instruments .|1
3086848252.jpg|0| A in man a collared shirt holds an unwrapped Christmas gift .| A man in a collared shirt holds an unwrapped Christmas gift .|1
3587449716.jpg|0| Three women in elaborate costumes hold up "" I Love You "" cards .| Three women in elaborate costumes hold up "" I Love You "" cards .|0
2192411521.jpg|0| A bearded man wearing a bandanna pointing is his finger whilst riding a bicycle .| A bearded man wearing a bandanna is pointing his finger whilst riding a bicycle .|1
1563731247.jpg|0| The girls play in the pumpkin patch .| The girls play in the pumpkin patch .|0
952457689.jpg|0| People at relaxing the park .| People relaxing at the park .|1
3064097919.jpg|0| A skateboarder is doing trick a off of a ramp while a guy looks on .| A skateboarder is doing a trick off of a ramp while a guy looks on .|1
5761090545.jpg|0| Two men in army-colored uniforms sawing a piece of wood on a construction site .| Two men in army-colored uniforms sawing a piece of wood on a construction site .|0
2802477687.jpg|0| Five people are wading and swimming at the edge a of river or lake .| Five people are wading and swimming at the edge of a river or lake .|1
19570587.jpg|0| A man jean in shorts is plugging a cord into a wall .| A man in jean shorts is plugging a cord into a wall .|1
5696549500.jpg|0| Recovery scuba divers on a boat heading to a scene .| Recovery scuba divers on a boat heading to a scene .|0
4980149155.jpg|0| Female looking at male while male away looks .| Female looking at male while male looks away .|1
3002915726.jpg|0| The man in the yellow hard hat standing is there in an orange life vest .| The man in the yellow hard hat is standing there in an orange life vest .|1
4107979730.jpg|0| A singer performs on stage at a concert .| A singer performs on stage at a concert .|0
366315886.jpg|0| Three men eating food on a couch .| Three men eating food on a couch .|0
5266810229.jpg|0| A pair of office workers diligently are performing their tasks on messy desks .| A pair of office workers are diligently performing their tasks on messy desks .|1
7591663030.jpg|0| Man riding a motorcycle on a road with pieces of cars on the side of the road .| Man riding a motorcycle on a road with pieces of cars on the side of the road .|0
3361279771.jpg|0| Two baseball players shake hands .| Two baseball players shake hands .|0
4374241200.jpg|0| A man walks close to a construction zone is that clearly marked .| A man walks close to a construction zone that is clearly marked .|1
8178657114.jpg|0| Three young men wearing shorts or swimsuits are playing on a beach during a sunset| Three young men wearing shorts or swimsuits are playing on a beach during a sunset|0
3364172642.jpg|0| A middle-aged man taking a rest after trapeze his act in the circus .| A middle-aged man taking a rest after his trapeze act in the circus .|1
476319548.jpg|0| A group of pedestrians using are a crosswalk in a city .| A group of pedestrians are using a crosswalk in a city .|1
686550300.jpg|0| A little boy is a watching woman .| A little boy is watching a woman .|1
459996676.jpg|0| little watching boy working man outside his home| little boy watching working man outside his home|1
3239260246.jpg|0| A standing woman in a group of people in an office like setting .| A woman standing in a group of people in an office like setting .|1
3412822878.jpg|0| A teenage boy does tricks on his skateboard in an area with much graffiti .| A teenage boy does tricks on his skateboard in an area with much graffiti .|0
3431636707.jpg|0| A man in a blue pin striped shirt waiting his for food that he has ordered .| A man in a blue pin striped shirt waiting for his food that he has ordered .|1
2415637042.jpg|0| Several people trying are to climb a ladder in a tree .| Several people are trying to climb a ladder in a tree .|1
3833511502.jpg|0| A man behind an old fashioned bank teller desk holds a pencil and smiles .| A man behind an old fashioned bank teller desk holds a pencil and smiles .|0
4954419612.jpg|0| An elderly woman , man a and a woman standing on a sidewalk together .| An elderly woman , a man and a woman standing on a sidewalk together .|1
8036413429.jpg|0| Two men dressed in matching blue uniforms , celebrate a victory .| Two men dressed in matching blue uniforms , celebrate a victory .|0
3032235201.jpg|0| A young girl wearing pink a hat and young boy wearing a dark shirt are eating cake .| A young girl wearing a pink hat and young boy wearing a dark shirt are eating cake .|1
52446935.jpg|0| A group of men are standing on wooded pier as the sun sets .| A group of men are standing on wooded pier as the sun sets .|0
3286620180.jpg|0| A large group of men and woman all wearing red t-shirts participate in a race .| A large group of men and woman all wearing red t-shirts participate in a race .|0
3971415488.jpg|0| A guitar player with a hat black , performing on his knees .| A guitar player with a black hat , performing on his knees .|1
6896996092.jpg|0| A full stadium watches a soccer match while food a vendor stands in the foreground .| A full stadium watches a soccer match while a food vendor stands in the foreground .|1
3541483943.jpg|0| A man performing a trick on a skateboard at a graffiti covered skate park .| A man performing a trick on a skateboard at a graffiti covered skate park .|0
860928274.jpg|0| A little boy smiles as he stands in a large inflatable toy .| A little boy smiles as he stands in a large inflatable toy .|0
3476101523.jpg|0| Teams on assemble a soccer field wearing blue , red , and yellow uniforms .| Teams assemble on a soccer field wearing blue , red , and yellow uniforms .|1
7096085535.jpg|0| A photographer is taking a picture of a team wearing red .| A photographer is taking a picture of a team wearing red .|0
3434755676.jpg|0| A group of people sitting around a table with paper in front of them .| A group of people sitting around a table with paper in front of them .|0
4942777259.jpg|0| A shirtless boy is walking down the beach a holding large branch .| A shirtless boy is walking down the beach holding a large branch .|1
1764955991.jpg|0| A large dog walks along a gravel path in the woods .| A large dog walks along a gravel path in the woods .|0
1211184847.jpg|0| Several men are working on tiles together while sitting on the floor .| Several men are working on tiles together while sitting on the floor .|0
10160966.jpg|0| A young man , wearing a white shirt , prepares hotdogs on a small grill .| A young man , wearing a white shirt , prepares hotdogs on a small grill .|0
292354399.jpg|0| Two girls with yellow hanging bags out at a bar .| Two girls with yellow bags hanging out at a bar .|1
2657301826.jpg|0| A toddler with a blue scarf wrapped on his head with plays a wooden toy .| A toddler with a blue scarf wrapped on his head plays with a wooden toy .|1
2698666984.jpg|0| A woman runner in red is getting drenched in rain the .| A woman runner in red is getting drenched in the rain .|1
3799987586.jpg|0| Someone is performing in the open an without audience .| Someone is performing in the open without an audience .|1
539218410.jpg|0| A man in blue shirt and pants stands in front of a large sign a displaying yak .| A man in blue shirt and pants stands in front of a large sign displaying a yak .|1
3498423815.jpg|0| A boy begins to ride a bike as a man holds the back of it .| A boy begins to ride a bike as a man holds the back of it .|0
3547600292.jpg|0| A black and yellow bird is a eating worm while resting on the grassy ground .| A black and yellow bird is eating a worm while resting on the grassy ground .|1
2598012140.jpg|0| White dog biting orange cat .| White dog biting orange cat .|0
4313861353.jpg|0| Two men together , one watching , one resting .| Two men together , one watching , one resting .|0
3469584002.jpg|0| A child enjoys time their on the beach with a leap from a rock onto the sand .| A child enjoys their time on the beach with a leap from a rock onto the sand .|1
7577634482.jpg|0| A person wearing a yellow jacket is riding white a motorcycle by a crowd of onlookers .| A person wearing a yellow jacket is riding a white motorcycle by a crowd of onlookers .|1
244774022.jpg|0| Man riding a surfboard on wave a .| Man riding a surfboard on a wave .|1
4604410267.jpg|0| A woman in green boots and a bag green talking on her cellphone as she walks .| A woman in green boots and a green bag talking on her cellphone as she walks .|1
3415230151.jpg|0| A boy having fun while playing Hacky Sack .| A boy having fun while playing Hacky Sack .|0
4448862529.jpg|0| A man falls onto the ball a during game of rugby .| A man falls onto the ball during a game of rugby .|1
489865145.jpg|0| A teenage girl with a shaved head walks a in brown skirt and blue jean jacket .| A teenage girl with a shaved head walks in a brown skirt and blue jean jacket .|1
5682364328.jpg|0| A man jumping his bicycle off dirt mounds several is feet in the air .| A man jumping his bicycle off dirt mounds is several feet in the air .|1
1796521614.jpg|0| A man with inflatable hammers and other inflatable goods .| A man with inflatable hammers and other inflatable goods .|0
289939071.jpg|0| The couple is kissing and lady red in turning her back .| The couple is kissing and lady in red turning her back .|1
2449973721.jpg|0| A golfer , wearing all brown , takes a swing towards the trees on a golf course .| A golfer , wearing all brown , takes a swing towards the trees on a golf course .|0
7740831042.jpg|0| Woman running down a center white line holding a javelin .| Woman running down a center white line holding a javelin .|0
2634907858.jpg|0| A boy in a park is watching a pigeon away fly .| A boy in a park is watching a pigeon fly away .|1
4748496940.jpg|0| Two young men wearing sunglasses and white polo shirts are standing outdoors looking at newspapers .| Two young men wearing sunglasses and white polo shirts are standing outdoors looking at newspapers .|0
2771424045.jpg|0| Wearing identical necklaces , a and woman a man with a painted face embrace .| Wearing identical necklaces , a woman and a man with a painted face embrace .|1
4751394653.jpg|0| A woman with an orange shirt selling vegetables on street the .| A woman with an orange shirt selling vegetables on the street .|1
519228867.jpg|0| A small girl in a tub water of .| A small girl in a tub of water .|1
3143159297.jpg|0| An old man and a baby in red .| An old man and a baby in red .|0
4196155263.jpg|0| a person taking a picture of a crowded place| a person taking a picture of a crowded place|0
2842439618.jpg|0| One surfer rides a wave while another surfer paddles at the base of the wave .| One surfer rides a wave while another surfer paddles at the base of the wave .|0
2051194177.jpg|0| A wet dog carrying a stick in its mouth is walking out of the lake .| A wet dog carrying a stick in its mouth is walking out of the lake .|0
2847281670.jpg|0| A lady and two small children are sitting on a park bench with pigeons at their feet .| A lady and two small children are sitting on a park bench with pigeons at their feet .|0
3441965806.jpg|0| This is an Asian looking Woman at shoes to purchase at a local swap meet .| This is an Asian Woman looking at shoes to purchase at a local swap meet .|1
2833509990.jpg|0| Large ground of men women and listening to something .| Large ground of men and women listening to something .|1
4813959713.jpg|0| A black woman is looking at her cellphone .| A black woman is looking at her cellphone .|0
4671642676.jpg|0| Men in black talk hats to a cop on the street .| Men in black hats talk to a cop on the street .|1
518602687.jpg|0| A man sitting at a piano singing .| A man sitting at a piano singing .|0
2328104318.jpg|0| A man in a hoodie is looking at a pad of paper , outside a window .| A man in a hoodie is looking at a pad of paper , outside a window .|0
7374362298.jpg|0| A man in a uniform with is glasses playing a french horn .| A man in a uniform with glasses is playing a french horn .|1
1401351228.jpg|0| Several elderly people are interacting with others .| Several elderly people are interacting with others .|0
4715269800.jpg|0| A firefighter looking out the window .| A firefighter looking out the window .|0
3244586044.jpg|0| The muzzled dog with the number eight races on the dirt track .| The muzzled dog with the number eight races on the dirt track .|0
414574330.jpg|0| Man outside in the rain promoting a 50 % off sale .| Man outside in the rain promoting a 50 % off sale .|0
1733853950.jpg|0| Two men in black coats stand by the side of a building .| Two men in black coats stand by the side of a building .|0
3379605465.jpg|0| There is a hanging man in the air from a pole .| There is a man hanging in the air from a pole .|1
1107507919.jpg|0| A cello player is playing during concert a .| A cello player is playing during a concert .|1
171614657.jpg|0| Four young children are walking barefoot while carrying bags of fruit .| Four young children are walking barefoot while carrying bags of fruit .|0
2833888275.jpg|0| Two women walk with purses walk down the street .| Two women walk with purses walk down the street .|0
4401472290.jpg|0| Women in robes walk across a marble floor .| Women in robes walk across a marble floor .|0
6939695046.jpg|0| A man sits outside in the partial shade in a hammock reading something .| A man sits outside in the partial shade in a hammock reading something .|0
2506703854.jpg|0| construction workers fixing an elevator shaft| construction workers fixing an elevator shaft|0
1353009866.jpg|0| The cat looks away from the next person to it .| The cat looks away from the person next to it .|1
3376227992.jpg|0| in Man a white shirt with a gold watch playing with a circuit board .| Man in a white shirt with a gold watch playing with a circuit board .|1
494792770.jpg|0| brown long-haired in dog garden .| brown long-haired dog in garden .|1
3761067976.jpg|0| A little girl in a yellow dress points while she holds a and ribbon a flower .| A little girl in a yellow dress points while she holds a ribbon and a flower .|1
5831994264.jpg|0| Singer performing on stage with acoustics| Singer performing on stage with acoustics|0
3610687607.jpg|0| A man is jumping with his body forward toward a photograph screen and a large photography light .| A man is jumping with his body forward toward a photograph screen and a large photography light .|0
5278036761.jpg|0| Two men dressed in slacks , one in brown sweater and one in blue sweater , sweeping .| Two men dressed in slacks , one in brown sweater and one in blue sweater , sweeping .|0
4199553000.jpg|0| hikers The climb the staircase in the woods .| The hikers climb the staircase in the woods .|1
7968277152.jpg|0| A group of people jumping into air the at the beach .| A group of people jumping into the air at the beach .|1
4747766224.jpg|0| A man with a beer alone sits at a table .| A man with a beer sits alone at a table .|1
5241430403.jpg|0| Three construction workers are standing on a boat while one of the men points at something .| Three construction workers are standing on a boat while one of the men points at something .|0
154873964.jpg|0| Group of women standing in front of a shop wearing a blond and wig black jacket .| Group of women standing in front of a shop wearing a blond wig and black jacket .|1
4577047554.jpg|0| model A is being photographed in a street .| A model is being photographed in a street .|1
3374054694.jpg|0| A dog jumps for the woman 's treat .| A dog jumps for the woman 's treat .|0
3000017878.jpg|0| A five member band is performing live music .| A five member band is performing live music .|0
4948424467.jpg|0| A band is performing on stage .| A band is performing on stage .|0
48296285.jpg|0| Two men cleaning a science laboratory .| Two men cleaning a science laboratory .|0
4934655888.jpg|0| A woman in black heels is speaking with another woman large wearing hoop earrings .| A woman in black heels is speaking with another woman wearing large hoop earrings .|1
4553404656.jpg|0| is Grandma introducing her granddaughter , the cellist .| Grandma is introducing her granddaughter , the cellist .|1
1590016063.jpg|0| Several young women walking along a beautiful hallway| Several young women walking along a beautiful hallway|0
2906329398.jpg|0| Two kids and a woman are sitting outside a on porch .| Two kids and a woman are sitting outside on a porch .|1
4432695449.jpg|0| Four police officers standing on a street with a clown walking in front of them .| Four police officers standing on a street with a clown walking in front of them .|0
150411291.jpg|0| children Two playing in the sand .| Two children playing in the sand .|1
2497934789.jpg|0| Three men getting some kind of grass together on a windy day .| Three men getting some kind of grass together on a windy day .|0
2566294211.jpg|0| Friends going are canoeing .| Friends are going canoeing .|1
4927987115.jpg|0| A man brown in shoes sits against a gray wall .| A man in brown shoes sits against a gray wall .|1
4373143112.jpg|0| A man lit in purple light plays a guitar sings and .| A man lit in purple light plays a guitar and sings .|1
3419916411.jpg|0| A brown dog is lying on a grassy field as the blows wind through his fur .| A brown dog is lying on a grassy field as the wind blows through his fur .|1
4230711609.jpg|0| A young boy goes through large rocks in the mountains .| A young boy goes through large rocks in the mountains .|0
2514581496.jpg|0| A white dog with orange ribbons is jumping up to see a countertop .| A white dog with orange ribbons is jumping up to see a countertop .|0
7916195052.jpg|0| A male skateboarder performs a stunt over a bicycle rake .| A male skateboarder performs a stunt over a bicycle rake .|0
464761361.jpg|0| A few Asian men and one Asian woman sitting at couple a of tables .| A few Asian men and one Asian woman sitting at a couple of tables .|1
4805078127.jpg|0| People are sitting around and in playing a fountain .| People are sitting around and playing in a fountain .|1
4655362399.jpg|0| An older man a wearing scarf sings through a microphone .| An older man wearing a scarf sings through a microphone .|1
2343879696.jpg|0| A woman is tossing a small child in air the playfully .| A woman is tossing a small child in the air playfully .|1
7951437376.jpg|0| A man and a enjoying woman the sunset on the pier .| A man and a woman enjoying the sunset on the pier .|1
3009729697.jpg|0| Four kids are on playing the sidewalk as two adults watch from chairs behind them .| Four kids are playing on the sidewalk as two adults watch from chairs behind them .|1
7512588306.jpg|0| A man plays a with baby , holding him up into the air .| A man plays with a baby , holding him up into the air .|1
1000092795.jpg|0| Two men in green shirts are in standing a yard .| Two men in green shirts are standing in a yard .|1
3381746410.jpg|0| A father and son are in a of field yellow flowers .| A father and son are in a field of yellow flowers .|1
2868652721.jpg|0| A counter person looks on at a food court .| A counter person looks on at a food court .|0
3410899419.jpg|0| a group young of naked children showering outside| a group of young naked children showering outside|1
276261357.jpg|0| young man showing his small child how to write .| young man showing his small child how to write .|0
4975066304.jpg|0| These two kids look like they are having fun just playing on the sidewalk .| These two kids look like they are having fun just playing on the sidewalk .|0
85707689.jpg|0| This man is running a large hand-dyeing operation .| This man is running a large hand-dyeing operation .|0
60644154.jpg|0| A young boy in a red shirt is playing with a dollhouse .| A young boy in a red shirt is playing with a dollhouse .|0
6310122280.jpg|0| A guy who is pitching a baseball with a blue hat .| A guy who is pitching a baseball with a blue hat .|0
4548082171.jpg|0| Three young participate girls in ballet instruction .| Three young girls participate in ballet instruction .|1
4803311880.jpg|0| A blond man with beard a at a concert holding a violin .| A blond man with a beard at a concert holding a violin .|1
3948611540.jpg|0| The News Spokeswomen being interviewed at local seminar .| The News Spokeswomen being interviewed at local seminar .|0
442983801.jpg|0| A baby girl eats a cookie while seated in a highchair and wearing a bib .| A baby girl eats a cookie while seated in a highchair and wearing a bib .|0
2443229844.jpg|0| A child in a bright blue sweatshirt playing in the woods with a wagon red .| A child in a bright blue sweatshirt playing in the woods with a red wagon .|1
3638688673.jpg|0| A boy swings a on swing set .| A boy swings on a swing set .|1
3006217970.jpg|0| A small race car with advertising is on driving a rainy track .| A small race car with advertising is driving on a rainy track .|1
1234293791.jpg|0| A girl in a helmet rides a horse .| A girl in a helmet rides a horse .|0
2716718260.jpg|0| A man with long hair tied back and wearing a blue shirt playing is a clarinet .| A man with long hair tied back and wearing a blue shirt is playing a clarinet .|1
4435154906.jpg|0| Many people are at sitting tables that are located outdoors .| Many people are sitting at tables that are located outdoors .|1
3396043950.jpg|0| A crowd of people gather for a meal indoors .| A crowd of people gather for a meal indoors .|0
370256193.jpg|0| An elderly woman in a light brown coat is walking down a street in a neighborhood .| An elderly woman in a light brown coat is walking down a street in a neighborhood .|0
3782706998.jpg|0| Swimmer dives into the blue pool water .| Swimmer dives into the blue pool water .|0
5812770731.jpg|0| A young female baseball player slides to home base but caught is by the umpire .| A young female baseball player slides to home base but is caught by the umpire .|1
209803062.jpg|0| woman A crouches down with a tennis racket in both hands .| A woman crouches down with a tennis racket in both hands .|1
2960095850.jpg|0| An artist painting a model dress in old-timey clothes .| An artist painting a model dress in old-timey clothes .|0
4589964880.jpg|0| Two males and female a in front of a building having conversation .| Two males and a female in front of a building having conversation .|1
200763637.jpg|0| Two children in harnesses are riding on zip lines .| Two children in harnesses are riding on zip lines .|0
288776839.jpg|0| A young boy in coat sits in a pile of leaves .| A young boy in coat sits in a pile of leaves .|0
3380364224.jpg|0| A ski boarder a making jump on a snowy hillside .| A ski boarder making a jump on a snowy hillside .|1
6638041153.jpg|0| Two women try to block a spike while playing volleyball .| Two women try to block a spike while playing volleyball .|0
4842713608.jpg|0| Women with fake blood and makeup all over her face , chest and neck .| Women with fake blood and makeup all over her face , chest and neck .|0
475317104.jpg|0| a woman wearing a black shirt and blue jeans standing on a sidewalk| a woman wearing a black shirt and blue jeans standing on a sidewalk|0
3192005501.jpg|0| woman in the hospital sticking her tongue out| woman in the hospital sticking her tongue out|0
4733999649.jpg|0| A man practices karate moves in silhouette with a backdrop of a colorful beach sunset .| A man practices karate moves in silhouette with a backdrop of a colorful beach sunset .|0
3710468717.jpg|0| Two children and a black dog are playing out in the snow .| Two children and a black dog are playing out in the snow .|0
2715064456.jpg|0| standing elephant on the tip of its trunk why a man watches .| elephant standing on the tip of its trunk why a man watches .|1
52581560.jpg|0| Long benchtops with microscopes have works at each station .| Long benchtops with microscopes have works at each station .|0
4441978051.jpg|0| A guy and a girl eating at restaurant a .| A guy and a girl eating at a restaurant .|1
3107592525.jpg|0| A man and a woman in plastic coverings .| A man and a woman in plastic coverings .|0
59032661.jpg|0| Six casually dressed people lounge around a small coffee table .| Six casually dressed people lounge around a small coffee table .|0
3280644936.jpg|0| A woman at the laundry mat is looking for something in her black leather purse .| A woman at the laundry mat is looking for something in her black leather purse .|0
4055310167.jpg|0| A man hammering nails in on a building .| A man hammering in nails on a building .|1
2647394564.jpg|0| A child is from leaping one bed to another in the same room .| A child is leaping from one bed to another in the same room .|1
2187222896.jpg|0| The boy in the red shirt is next to a blue wall .| The boy in the red shirt is next to a blue wall .|0
1814086703.jpg|0| Two dogs run near together the leaves .| Two dogs run together near the leaves .|1
