image_name|comment_number|comment|original|target
3785465924.jpg|0| Two siblings hiding in tall , vivid green grass .| Two siblings hiding in tall , vivid green grass .|0
3846674484.jpg|0| A girl putting her hands into water dirty .| A girl putting her hands into dirty water .|1
310779961.jpg|0| A small boy is crying in a park while a small girl looks on .| A small boy is crying in a park while a small girl looks on .|0
2407865161.jpg|0| A woman carrying a white bag with a star red walking on the sidewalk .| A woman carrying a white bag with a red star walking on the sidewalk .|1
6192034820.jpg|0| Someone in Asian costume is sitting down and holding a sword .| Someone in Asian costume is sitting down and holding a sword .|0
4782298436.jpg|0| A crowd covered in blood on gathered the street .| A crowd covered in blood gathered on the street .|1
2907088408.jpg|0| Three in women a store looking at a bird that one of the women has .| Three women in a store looking at a bird that one of the women has .|1
4603555535.jpg|0| A woman scratches her cheek as she walking down a sidewalk alone .| A woman scratches her cheek as she walking down a sidewalk alone .|0
490527535.jpg|0| man A in a blue shirt and hat is walking along the beach .| A man in a blue shirt and hat is walking along the beach .|1
1499554025.jpg|0| People dressed in all white are looking at some shaved lambs .| People dressed in all white are looking at some shaved lambs .|0
749840385.jpg|0| A man stands outside of a doorway on his cellphone .| A man stands outside of a doorway on his cellphone .|0
2446924427.jpg|0| People at theater , man in black reading program .| People at theater , man in black reading program .|0
3582048078.jpg|0| Father and son swimming .| Father and son swimming .|0
7814014742.jpg|0| Three motor-cross bike racers in a competition .| Three motor-cross bike racers in a competition .|0
3873835329.jpg|0| A good-looking firefighter sets up "" Do Cross Not "" tape in the city .| A good-looking firefighter sets up "" Do Not Cross "" tape in the city .|1
4728581339.jpg|0| A woman with brown hair and large sunglasses is staring at something outside of the picture .| A woman with brown hair and large sunglasses is staring at something outside of the picture .|0
3733511876.jpg|0| Two shirtless Indian men in a park , next to a younger boy on a bike .| Two shirtless Indian men in a park , next to a younger boy on a bike .|0
4898640485.jpg|0| A redheaded woman walks through a crowded park .| A redheaded woman walks through a crowded park .|0
4450689424.jpg|0| lady A wearing scarf hat and sunglasses shopping .| A lady wearing scarf hat and sunglasses shopping .|1
1409702228.jpg|0| The man in a dark blue shirt is squeezing a bottle filled with a gold-colored substance .| The man in a dark blue shirt is squeezing a bottle filled with a gold-colored substance .|0
2409771090.jpg|0| A man on stage as people watch him and wave arms .| A man on stage as people watch him and wave arms .|0
2354914657.jpg|0| A fireman douses a red truck that is smoking a as police officer approaches .| A fireman douses a red truck that is smoking as a police officer approaches .|1
2882589788.jpg|0| A girl in a blue uniform raises her arm .| A girl in a blue uniform raises her arm .|0
5416898306.jpg|0| Enjoying a rope park on a sunny day .| Enjoying a rope park on a sunny day .|0
4515663265.jpg|0| A woman in white clothing two and children wade through a stream .| A woman in white clothing and two children wade through a stream .|1
181970350.jpg|0| A brown-haired man in a patterned and shirt purple tie is singing into a microphone .| A brown-haired man in a patterned shirt and purple tie is singing into a microphone .|1
2709359730.jpg|0| A group of dogs walk outdoors around .| A group of dogs walk around outdoors .|1
5608502395.jpg|0| An adult martial artist teaching a young some boy defensive moves on a mat in a gym .| An adult martial artist teaching a young boy some defensive moves on a mat in a gym .|1
302241178.jpg|0| A dog in water carrying a stick long .| A dog in water carrying a long stick .|1
3648097366.jpg|0| a skateboarder jumps the stairs .| a skateboarder jumps the stairs .|0
4965386726.jpg|0| Riders waiting to get on the train .| Riders waiting to get on the train .|0
4678109394.jpg|0| People sitting on a next sidewalk to a rail that overlooks a body of water .| People sitting on a sidewalk next to a rail that overlooks a body of water .|1
3589425899.jpg|0| A man jumps a into bed that is set up on a public walkway .| A man jumps into a bed that is set up on a public walkway .|1
3046286572.jpg|0| The man is doing a trick on a in bike midair .| The man is doing a trick on a bike in midair .|1
6309331514.jpg|0| A band called "" The Early November "" giving a concert to a crowded room .| A band called "" The Early November "" giving a concert to a crowded room .|0
917574521.jpg|0| Two girls are dressed the same and one of is them playing with a toy lawn mower .| Two girls are dressed the same and one of them is playing with a toy lawn mower .|1
4688194296.jpg|0| People standing together under a "" start "" in banner the street .| People standing together under a "" start "" banner in the street .|1
183018056.jpg|0| A group of walking people with a large inflated Oscar the Grouch .| A group of people walking with a large inflated Oscar the Grouch .|1
3141832468.jpg|0| A young boy wearing a made hat out of balloons smiles along with his dad .| A young boy wearing a hat made out of balloons smiles along with his dad .|1
2223382277.jpg|0| Two children are playing hockey a on frozen pond| Two children are playing hockey on a frozen pond|1
2550756380.jpg|0| A woman dances by herself as many people , in formal attire , watch .| A woman dances by herself as many people , in formal attire , watch .|0
450425195.jpg|0| Young girl with painted face and pigtails is sitting on a bench at water 's edge .| Young girl with painted face and pigtails is sitting on a bench at water 's edge .|0
4316023148.jpg|0| A woman is sitting in the train .| A woman is sitting in the train .|0
4668918959.jpg|0| A young man riding bicycle her home after long day work in his family city restaurant .| A young man riding her bicycle home after long day work in his family city restaurant .|1
1390860274.jpg|0| Grandfather while fishes grandson waits with net .| Grandfather fishes while grandson waits with net .|1
4665106597.jpg|0| A man and woman are walking down a waterside toward path a suspension bridge .| A man and woman are walking down a waterside path toward a suspension bridge .|1
4756096571.jpg|0| A woman rides a bicycle across the street while holding an umbrella .| A woman rides a bicycle across the street while holding an umbrella .|0
5757814392.jpg|0| Little boy in orange shirt , holding flip-flops has his hand his on head .| Little boy in orange shirt , holding flip-flops has his hand on his head .|1
4862041366.jpg|0| A little girl on the beach with a shovel in hand .| A little girl on the beach with a shovel in hand .|0
3303085500.jpg|0| A woman with a black shirt has her arm across another woman 's shoulder .| A woman with a black shirt has her arm across another woman 's shoulder .|0
4705913066.jpg|0| A man is giving a presentation using a projector .| A man is giving a presentation using a projector .|0
3710916676.jpg|0| Several children are working on arts and crafts| Several children are working on arts and crafts|0
35477421.jpg|0| People enjoying cookout food in a public park .| People enjoying cookout food in a public park .|0
3955157194.jpg|0| A small child in a white t-shirt sits behind a large machine and holds on .| A small child in a white t-shirt sits behind a large machine and holds on .|0
3217240672.jpg|0| A group of people ride down the road in a large tractor .| A group of people ride down the road in a large tractor .|0
3970114165.jpg|0| Two fans are cheering a at sporting event .| Two fans are cheering at a sporting event .|1
3135980417.jpg|0| Two young women having a conversation| Two young women having a conversation|0
4732859171.jpg|0| A motorboat is gliding through dusty the waters of Venice .| A motorboat is gliding through the dusty waters of Venice .|1
1693115528.jpg|0| A young woman watches a hockey game in a restaurant booth .| A young woman watches a hockey game in a restaurant booth .|0
7556970798.jpg|0| A food service person is giving a customer their double ice scoop cream in a cone .| A food service person is giving a customer their double scoop ice cream in a cone .|1
4162702.jpg|0| Two women dressed in blue are walking through a grassy hillside .| Two women dressed in blue are walking through a grassy hillside .|0
4527656043.jpg|0| group A of people sitting at tables near a beach .| A group of people sitting at tables near a beach .|1
3996888830.jpg|0| A little boy flinches as a deer kisses him on the cheek .| A little boy flinches as a deer kisses him on the cheek .|0
4501102617.jpg|0| Two men are playing instruments on a sidewalk .| Two men are playing instruments on a sidewalk .|0
6864445068.jpg|0| This man is the winner of the game .| This man is the winner of the game .|0
3632572264.jpg|0| soccer Two teams posing .| Two soccer teams posing .|1
3561639055.jpg|0| A biker lands on the ground after flying through the air .| A biker lands on the ground after flying through the air .|0
2893476169.jpg|0| A in man midair on a skateboard .| A man in midair on a skateboard .|1
3638631362.jpg|0| A person is picking up a yellow tent by his or herself in the great outdoors .| A person is picking up a yellow tent by his or herself in the great outdoors .|0
7252718418.jpg|0| adorable An little girl with pigtails and glasses is about to take a swing at a baseball .| An adorable little girl with pigtails and glasses is about to take a swing at a baseball .|1
407453309.jpg|0| People in clusters of twos and threes stand around an outdoor fountain .| People in clusters of twos and threes stand around an outdoor fountain .|0
455856615.jpg|0| Two feet wearing yellow boots ski on ski| Two feet wearing yellow ski boots on ski|1
2701487024.jpg|0| A boy young with a blue body board .| A young boy with a blue body board .|1
2677528593.jpg|0| People in wetsuits jump into the from water a concrete dock .| People in wetsuits jump into the water from a concrete dock .|1
4783077148.jpg|0| A man and woman outside sitting a shop next to an empty road .| A man and woman sitting outside a shop next to an empty road .|1
3489014985.jpg|0| A group people of are picking crops in a field outdoors .| A group of people are picking crops in a field outdoors .|1
4623188792.jpg|0| A man with a cigarette is to listening another man in dress clothes holding a can .| A man with a cigarette is listening to another man in dress clothes holding a can .|1
5615077255.jpg|0| Children and staff sit on the floor and paint in a recreation center .| Children and staff sit on the floor and paint in a recreation center .|0
200875615.jpg|0| A dedicated worker working his on craft shirtless .| A dedicated worker working on his craft shirtless .|1
2826647354.jpg|0| Two young boys ride small bikes on the road of a neighborhood .| Two young boys ride small bikes on the road of a neighborhood .|0
477990943.jpg|0| One girl is eating a green apple outside while another looks the into distance .| One girl is eating a green apple outside while another looks into the distance .|1
287641817.jpg|0| An older man in an apron cleaning .| An older man in an apron cleaning .|0
5823310445.jpg|0| man A puts a little girl atop his shoulders while walking down a busy street .| A man puts a little girl atop his shoulders while walking down a busy street .|1
3571220254.jpg|0| A man is playing guitar in the street for a small crowd .| A man is playing guitar in the street for a small crowd .|0
4474053436.jpg|0| The in lady purple is pushing the child in a wagon .| The lady in purple is pushing the child in a wagon .|1
640173336.jpg|0| motorcycle track , and rider .| motorcycle track , and rider .|0
4915015674.jpg|0| Group of american camel riders on a dirt road smiling and fun having .| Group of american camel riders on a dirt road smiling and having fun .|1
2774430374.jpg|0| A little boy to preparing hit a baseball| A little boy preparing to hit a baseball|1
3676460610.jpg|0| A woman rides a bike on a trail through a field .| A woman rides a bike on a trail through a field .|0
2077433632.jpg|0| i do n't see a picture i do n't see a picture i do n't see a picture| i do n't see a picture i do n't see a picture i do n't see a picture|0
4464247181.jpg|0| A woman puts her arm on a person sitting in a wheelchair .| A woman puts her arm on a person sitting in a wheelchair .|0
4972129585.jpg|0| A group of men sits around a table .| A group of men sits around a table .|0
4611771929.jpg|0| Man in blue shirt plays foosball along a side woman in a white shirt .| Man in blue shirt plays foosball along side a woman in a white shirt .|1
5662260935.jpg|0| A man in a black shirt and shorts with flame decals is miming a boxing motion .| A man in a black shirt and shorts with flame decals is miming a boxing motion .|0
3233683038.jpg|0| A guitarist on stage playing and singing with his keyboardist in the background .| A guitarist on stage playing and singing with his keyboardist in the background .|0
3262185149.jpg|0| A man concentrates his on music , holding his violin .| A man concentrates on his music , holding his violin .|1
6537080127.jpg|0| guys Two are having a lunch of sandwiches and chips .| Two guys are having a lunch of sandwiches and chips .|1
2788945468.jpg|0| a middle-aged man is standing next to a white wall underneath some catholic theme pictures .| a middle-aged man is standing next to a white wall underneath some catholic theme pictures .|0
4567985212.jpg|0| A few umbrellas on a rainy day in a area crowded .| A few umbrellas on a rainy day in a crowded area .|1
4035354150.jpg|0| A woman in a bikini is pouring a drink for a man .| A woman in a bikini is pouring a drink for a man .|0
96113759.jpg|0| A geisha applies makeup to her face .| A geisha applies makeup to her face .|0
3261493263.jpg|0| A dog sled races through the snow .| A dog sled races through the snow .|0
2966471030.jpg|0| Six men of varying sitting ethnicity at a table drinking beer , talking , and playing cards .| Six men of varying ethnicity sitting at a table drinking beer , talking , and playing cards .|1
2404747797.jpg|0| Two young children getting orange ice cream .| Two young children getting orange ice cream .|0
300550441.jpg|0| woman The wearing the brown skirt is carrying a black bag along a wooden walkway .| The woman wearing the brown skirt is carrying a black bag along a wooden walkway .|1
4971935706.jpg|0| Three people sitting in front of water next to an alligator sign warning .| Three people sitting in front of water next to an alligator warning sign .|1
276598014.jpg|0| A man in a black jacket plays a black guitar electric and sings .| A man in a black jacket plays a black electric guitar and sings .|1
3394070357.jpg|0| A tan small dog jumping out of the water| A small tan dog jumping out of the water|1
2483993772.jpg|0| Large brown dog jumps for blue ball| Large brown dog jumps for blue ball|0
707972553.jpg|0| A child in a straw hat stands on stones at a beach .| A child in a straw hat stands on stones at a beach .|0
6995905943.jpg|0| A team plays ball in the sand as a few spectators look on the from stands .| A team plays ball in the sand as a few spectators look on from the stands .|1
5897657716.jpg|0| A group of multi-ethnic young people sit in a circle on grass next to a hill .| A group of multi-ethnic young people sit in a circle on grass next to a hill .|0
3179498084.jpg|0| A Caucasian woman listens as an Asian man in camouflage explains something .| A Caucasian woman listens as an Asian man in camouflage explains something .|0
7712229454.jpg|0| Cameramen filming an athlete throwing a javelin .| Cameramen filming an athlete throwing a javelin .|0
3623331945.jpg|0| child The in the blue shirt is running through the sand .| The child in the blue shirt is running through the sand .|1
3091921457.jpg|0| Four children looking out a window .| Four children looking out a window .|0
4729528844.jpg|0| A man is sitting reading a book .| A man is sitting reading a book .|0
4849250874.jpg|0| A man wearing jeans gets a new tattoo .| A man wearing jeans gets a new tattoo .|0
7832183018.jpg|0| The team swiftly moves their traditional down boat the river .| The team swiftly moves their traditional boat down the river .|1
189244453.jpg|0| A man is pointing into another man 's hand .| A man is pointing into another man 's hand .|0
3756739471.jpg|0| A man in a bathing cap and swimsuit jumps into a pool while other men watch .| A man in a bathing cap and swimsuit jumps into a pool while other men watch .|0
132991765.jpg|0| A man sips his drink from a mug at an outdoor cafe .| A man sips his drink from a mug at an outdoor cafe .|0
2387494200.jpg|0| A man and woman walk by a window with a mannequin in the window .| A man and woman walk by a window with a mannequin in the window .|0
2882402709.jpg|0| A little girl jumped with her arms stretched in out front of her .| A little girl jumped with her arms stretched out in front of her .|1
158898445.jpg|0| A young man writing down answers or perhaps taking notes in a classroom .| A young man writing down answers or perhaps taking notes in a classroom .|0
260217340.jpg|0| A woman with a bucket standing beside a picket fence .| A woman with a bucket standing beside a picket fence .|0
4367623209.jpg|0| A man holds his child at a restaurant as the reaches child across the table .| A man holds his child at a restaurant as the child reaches across the table .|1
4929501260.jpg|0| A road near the waterfront where various people walk and ride their bikes nearby .| A road near the waterfront where various people walk and ride their bikes nearby .|0
3053000489.jpg|0| Three people of various ages are relaxing near a log in a grassy area .| Three people of various ages are relaxing near a log in a grassy area .|0
4886969953.jpg|0| An old is man sleeping in a chair outside an abandoned building .| An old man is sleeping in a chair outside an abandoned building .|1
4328446793.jpg|0| A small group of children all looking in the same direction .| A small group of children all looking in the same direction .|0
1438580125.jpg|0| Yellow barriers are lined up and men are walking on both of sides them .| Yellow barriers are lined up and men are walking on both sides of them .|1
4486982499.jpg|0| A white bike is leaning against a post .| A white bike is leaning against a post .|0
1469107065.jpg|0| A driving man a tractor pulls along two young children for a ride .| A man driving a tractor pulls along two young children for a ride .|1
2270955453.jpg|0| Many are people sitting in a restaurant eating their meals .| Many people are sitting in a restaurant eating their meals .|1
1220027979.jpg|0| Two little boys and a baby girl sit a on striped seat outside .| Two little boys and a baby girl sit on a striped seat outside .|1
2326795765.jpg|0| A bellhop is pushing a cart .| A bellhop is pushing a cart .|0
2941340576.jpg|0| Cops asking a tow truck man some questions .| Cops asking a tow truck man some questions .|0
2876232980.jpg|0| A small child pushes in another a wheelbarrow .| A small child pushes another in a wheelbarrow .|1
638855308.jpg|0| A blond headed lady is walking in of front a group of three people .| A blond headed lady is walking in front of a group of three people .|1
3029715635.jpg|0| A black is dog running with a blue bone in his mouth .| A black dog is running with a blue bone in his mouth .|1
4907068336.jpg|0| Many people wearing helmets .| Many people wearing helmets .|0
4705826208.jpg|0| two people waiting on the corner .| two people waiting on the corner .|0
3395867984.jpg|0| Some aggressive lacrosse female players are mid-game .| Some aggressive female lacrosse players are mid-game .|1
3771613841.jpg|0| A group of men enjoy a day of fishing .| A group of men enjoy a day of fishing .|0
4606967207.jpg|0| An Asian man prepares food on a counter next to a cat .| An Asian man prepares food on a counter next to a cat .|0
7849579912.jpg|0| Two people are climbing a rock big .| Two people are climbing a big rock .|1
3009018821.jpg|0| Woman playing badminton in the pool while another woman looks on .| Woman playing badminton in the pool while another woman looks on .|0
156642718.jpg|0| Toddler sits on carpet in living room touching guitar .| Toddler sits on carpet in living room touching guitar .|0
20450474.jpg|0| A boy sits facing backwards in a car making while a peace sign .| A boy sits facing backwards in a car while making a peace sign .|1
510711623.jpg|0| Four people looking at large outside advertisements .| Four people looking at large advertisements outside .|1
6978226931.jpg|0| A sweaty drummer feels the music as drums he away .| A sweaty drummer feels the music as he drums away .|1
432870699.jpg|0| This is some sort of band symphony or practicing .| This is some sort of band or symphony practicing .|1
2587846523.jpg|0| a man about to throw a tennis ball to a brown dog in the grass| a man about to throw a tennis ball to a brown dog in the grass|0
3983980965.jpg|0| a Dancers standing on a sidewalk .| Dancers a standing on a sidewalk .|1
1283974580.jpg|0| A wearing child a blue helmet with stars explores a bicycle| A child wearing a blue helmet with stars explores a bicycle|1
4600972102.jpg|0| A man holding a beer is looking at an old man eating lays potato chips .| A man holding a beer is looking at an old man eating lays potato chips .|0
5307401202.jpg|0| This woman is singing on stage at a concert .| This woman is singing on stage at a concert .|0
4811270159.jpg|0| Lady looking vegetables at in outside market .| Lady looking at vegetables in outside market .|1
2912692890.jpg|0| A man and his son carrying bags are enjoying a meal .| A man and his son carrying bags are enjoying a meal .|0
3249014584.jpg|0| A man has a chainsaw and is carving a block of ice .| A man has a chainsaw and is carving a block of ice .|0
4768114318.jpg|0| A group of wearing people green and yellow shirts look up .| A group of people wearing green and yellow shirts look up .|1
3723727436.jpg|0| An in shape woman is pole vaulting successfully and is next to a track and field .| An in shape woman is pole vaulting successfully and is next to a track and field .|0
2458543148.jpg|0| A well dressed man with glasses working with an open piano .| A well dressed man with glasses working with an open piano .|0
2325025735.jpg|0| A little is girl climbing up some very tall rocks .| A little girl is climbing up some very tall rocks .|1
4899253248.jpg|0| A caucasian girl with pink goggles and hair brown is blowing bubbles underwater .| A caucasian girl with pink goggles and brown hair is blowing bubbles underwater .|1
1269844288.jpg|0| Woman adjusting her boot near a large crowd of people an at outdoor event .| Woman adjusting her boot near a large crowd of people at an outdoor event .|1
5871124252.jpg|0| A man dressed in black plays a long with instrument others in an orchestra .| A man dressed in black plays a long instrument with others in an orchestra .|1
3100115206.jpg|0| an elderly lady is laying on a grassy hill front in of the ocean| an elderly lady is laying on a grassy hill in front of the ocean|1
3211581957.jpg|0| A horse leaps a hurdle with a rider on its back .| A horse leaps a hurdle with a rider on its back .|0
3834563658.jpg|0| man A watches a girl jump into a pool .| A man watches a girl jump into a pool .|1
372559387.jpg|0| A crowd standing in a room their with backs to the camera .| A crowd standing in a room with their backs to the camera .|1
532057410.jpg|0| Group of casually dressed people walking , towards a large sea vessel .| Group of casually dressed people , walking towards a large sea vessel .|1
4254863635.jpg|0| A construction worker takes a moment to wipe his face working while in the hot sun outdoors .| A construction worker takes a moment to wipe his face while working in the hot sun outdoors .|1
3923616497.jpg|0| A shirtless man in white pants is fire breathing in front of spectators in Indian style clothing .| A shirtless man in white pants is breathing fire in front of spectators in Indian style clothing .|1
143237785.jpg|0| A man holds a large on fish a boat .| A man holds a large fish on a boat .|1
4756001265.jpg|0| A kid is in playing the middle of a shopping plaza .| A kid is playing in the middle of a shopping plaza .|1
4927298788.jpg|0| Girl doing yoga on a cliff .| Girl doing yoga on a cliff .|0
2806632713.jpg|0| person A is flipping upside down while attached to some bungee cords .| A person is flipping upside down while attached to some bungee cords .|1
128912885.jpg|0| A white dog is jumping in the air attempting to catch a red ball .| A white dog is jumping in the air attempting to catch a red ball .|0
4533797010.jpg|0| A man in a blue shirt holds up a protest sign .| A man in a blue shirt holds up a protest sign .|0
4447160600.jpg|0| Uniformed police officer stands outside a New catholic York church .| Uniformed police officer stands outside a New York catholic church .|1
4579972123.jpg|0| A woman in yellow is walking outside of a building .| A woman in yellow is walking outside of a building .|0
1515883224.jpg|0| A woman in a blue in shirt a crowd .| A woman in a blue shirt in a crowd .|1
